{
  "$schema": "https://json-schema.org/draft/2020-12/schema",
  "$id": "https://poliklot.github.io/bridge-design-methodology/schema/page-check-coverage.schema.json",
  "title": "DFC Bridge Figma Page Check coverage snapshot",
  "type": "object",
  "additionalProperties": false,
  "required": ["$schema", "methodology", "pluginVersion", "catalogVersion", "verifiedAt", "implementation", "counts", "automaticRuleIds", "heuristicRuleIds"],
  "properties": {
    "$schema": { "const": "./page-check-coverage.schema.json" },
    "methodology": { "enum": ["DFC Bridge", "BRIDGE"] },
    "pluginVersion": { "type": "string", "pattern": "^[0-9]+\\.[0-9]+\\.[0-9]+$" },
    "catalogVersion": { "type": "string", "pattern": "^[0-9]+\\.[0-9]+\\.[0-9]+$" },
    "verifiedAt": { "type": "string", "format": "date" },
    "implementation": {
      "type": "object",
      "additionalProperties": false,
      "required": ["product", "feature", "coverageBasis", "visibility"],
      "properties": {
        "product": { "const": "DFC Bridge Figma plugin" },
        "feature": { "const": "Page Check" },
        "coverageBasis": { "const": "exact-emitted-rule-union" },
        "visibility": { "enum": ["private", "public"] }
      }
    },
    "counts": {
      "type": "object",
      "additionalProperties": false,
      "required": ["catalogRules", "pageCheckRules", "automaticRules", "heuristicRules"],
      "properties": {
        "catalogRules": { "type": "integer", "minimum": 1 },
        "pageCheckRules": { "type": "integer", "minimum": 0 },
        "automaticRules": { "type": "integer", "minimum": 0 },
        "heuristicRules": { "type": "integer", "minimum": 0 }
      }
    },
    "automaticRuleIds": { "$ref": "#/$defs/ruleIds" },
    "heuristicRuleIds": { "$ref": "#/$defs/ruleIds" },
    "sourceInteractionContracts": {
      "type": "object",
      "additionalProperties": false,
      "required": [
        "source",
        "localIntent",
        "instanceInteriors",
        "unclassifiedOrUnavailable",
        "runtimeBehavior"
      ],
      "properties": {
        "source": {
          "const": "explicit-main-component-or-component-set-intent"
        },
        "localIntent": {
          "const": "overrides-source-including-drafts"
        },
        "instanceInteriors": {
          "const": "not-traversed"
        },
        "unclassifiedOrUnavailable": {
          "const": "not-inspected"
        },
        "runtimeBehavior": {
          "const": "not-verified"
        }
      }
    }
  },
  "$defs": {
    "ruleIds": {
      "type": "array",
      "uniqueItems": true,
      "items": { "type": "string", "pattern": "^[a-z][a-z0-9-]*\\.[a-z][a-z0-9-]*$" }
    }
  }
}
